{
  "base_lineage": null,
  "base_lineage_ref": "",
  "base_routing_source": "",
  "case_id": "CASE_B9E914A3762C",
  "executed_at": "2026-10-05T20:19:23.166348+00:00",
  "focal_lineage": {
    "commits": [
      {
        "author_time": "2023-12-12T17:14:27Z",
        "author_time_relation": "at_or_before_tfg",
        "author_time_sensitivity": "same_side_of_tfg",
        "committer_time": "2023-12-12T17:14:27Z",
        "committer_time_relation": "at_or_before_tfg",
        "effective_time": "2023-12-12T17:14:27+00:00",
        "effective_time_relation": "at_or_before_tfg",
        "parent_shas": [
          "36e85dd3d425bc1316d8f27aa785fd906ffbb3eb"
        ],
        "position": 1,
        "pr_number": 171,
        "provenance": {
          "attempts": [
            {
              "attempt": 1,
              "http_status": 200,
              "retrieved_at": "2026-10-05T20:19:22.199979+00:00",
              "status": "success",
              "url": "https://api.github.com/repos/ory/elements/pulls/171/commits?per_page=100&page=1"
            }
          ],
          "retrieved_at": "2026-10-05T20:19:22.199979+00:00",
          "sha256": "d05ff42f8750cb35a15a318498dcc592cb6bd4710fed2d6d0884013b7871651b",
          "source": "https://api.github.com/repos/ory/elements/pulls/171/commits?per_page=100&page=1"
        },
        "repository": "ory/elements",
        "sha": "75aec434957a89d1ea95a68463e22be52b5d6fcc",
        "temporal_basis": "committer_time",
        "tree_sha": "c2b5fbea75df7cd2cbd70c9052385dd55b4ba6b6"
      }
    ],
    "first_post_tfg": null,
    "reasons": [],
    "selected": {
      "author_time": "2023-12-12T17:14:27Z",
      "author_time_relation": "at_or_before_tfg",
      "author_time_sensitivity": "same_side_of_tfg",
      "committer_time": "2023-12-12T17:14:27Z",
      "committer_time_relation": "at_or_before_tfg",
      "effective_time": "2023-12-12T17:14:27+00:00",
      "effective_time_relation": "at_or_before_tfg",
      "parent_shas": [
        "36e85dd3d425bc1316d8f27aa785fd906ffbb3eb"
      ],
      "position": 1,
      "pr_number": 171,
      "provenance": {
        "attempts": [
          {
            "attempt": 1,
            "http_status": 200,
            "retrieved_at": "2026-10-05T20:19:22.199979+00:00",
            "status": "success",
            "url": "https://api.github.com/repos/ory/elements/pulls/171/commits?per_page=100&page=1"
          }
        ],
        "retrieved_at": "2026-10-05T20:19:22.199979+00:00",
        "sha256": "d05ff42f8750cb35a15a318498dcc592cb6bd4710fed2d6d0884013b7871651b",
        "source": "https://api.github.com/repos/ory/elements/pulls/171/commits?per_page=100&page=1"
      },
      "repository": "ory/elements",
      "sha": "75aec434957a89d1ea95a68463e22be52b5d6fcc",
      "temporal_basis": "committer_time",
      "tree_sha": "c2b5fbea75df7cd2cbd70c9052385dd55b4ba6b6"
    },
    "selected_to_first_post_relationship": "not_applicable",
    "temporal_consistency": "consistent"
  },
  "historical_observability": "not_confirmed",
  "lineage_source": "established_focal_pr",
  "materialization": {
    "commit_sha": "75aec434957a89d1ea95a68463e22be52b5d6fcc",
    "complete_recursive_tree": true,
    "deterministic_repeat": true,
    "object_type": "commit",
    "parent_shas": [
      "36e85dd3d425bc1316d8f27aa785fd906ffbb3eb"
    ],
    "recursive_tree_entry_count": 921,
    "recursive_tree_listing_sha256": "12fef661a131d79c37a081a0f069dcc555adb75f504eb9c9e2a8c7ccb07a6ab3",
    "retrieved_at": "2026-10-05T20:19:23.163276+00:00",
    "source": "https://github.com/ory/elements.git",
    "status": "materialized",
    "tree_sha": "c2b5fbea75df7cd2cbd70c9052385dd55b4ba6b6"
  },
  "pr_number": 171,
  "procedure_version": "post-stage-c-git-lineage-v4",
  "provenance": {
    "base_pages": [],
    "base_route_evidence": {},
    "current_default_branch_candidate_used": false,
    "current_pr_base_sha_provenance_only": "87f0f2478687700837b8e0fa1a28e5d64c5fb57a",
    "focal_pages": [
      {
        "attempts": [
          {
            "attempt": 1,
            "http_status": 200,
            "retrieved_at": "2026-10-05T20:19:22.199979+00:00",
            "status": "success",
            "url": "https://api.github.com/repos/ory/elements/pulls/171/commits?per_page=100&page=1"
          }
        ],
        "retrieved_at": "2026-10-05T20:19:22.199979+00:00",
        "sha256": "d05ff42f8750cb35a15a318498dcc592cb6bd4710fed2d6d0884013b7871651b",
        "source": "https://api.github.com/repos/ory/elements/pulls/171/commits?per_page=100&page=1"
      }
    ],
    "outcome_inputs_enabled": false,
    "post_tfg_content_admitted": false,
    "pr": {
      "attempts": [
        {
          "attempt": 1,
          "http_status": 200,
          "retrieved_at": "2026-10-05T20:19:21.745933+00:00",
          "status": "success",
          "url": "https://api.github.com/repos/ory/elements/pulls/171"
        }
      ],
      "retrieved_at": "2026-10-05T20:19:21.745933+00:00",
      "sha256": "b3cae3b1ce30171e62df2acacfcaf4d913935d333c52e7a3e2b168f333b6e910",
      "source": "https://api.github.com/repos/ory/elements/pulls/171"
    },
    "recorded_pr_base_ref_resolves": false
  },
  "reconstruction_contract": "post-stage-c-reconstruction-v4",
  "reconstruction_path": "focal",
  "reconstruction_status": "reconstructed_focal_state",
  "record_version": "historical-state-acquisition-v4",
  "repository": "ory/elements",
  "selected_state": {
    "author_time": "2023-12-12T17:14:27Z",
    "author_time_sensitivity": "same_side_of_tfg",
    "commit_sha": "75aec434957a89d1ea95a68463e22be52b5d6fcc",
    "committer_time": "2023-12-12T17:14:27Z",
    "effective_time": "2023-12-12T17:14:27+00:00",
    "temporal_basis": "committer_time",
    "tree_sha": "c2b5fbea75df7cd2cbd70c9052385dd55b4ba6b6"
  },
  "tC": {
    "source": "first developer turn in parsed conversation; not a selection input",
    "value": "2023-12-21T13:44:45.454568+00:00"
  },
  "tFG": {
    "source": "cases/manifests/stage_c_post_resolution_authority.csv",
    "value": "2023-12-21T13:45:06.739286+00:00"
  },
  "temporal_consistency": "consistent",
  "unresolved_reasons": []
}
