{
  "base_lineage": null,
  "base_lineage_ref": "",
  "base_routing_source": "",
  "case_id": "CASE_3E3A525883BA",
  "executed_at": "2026-10-05T20:16:53.917602+00:00",
  "focal_lineage": {
    "commits": [
      {
        "author_time": "2023-10-24T14:29:04Z",
        "author_time_relation": "at_or_before_tfg",
        "author_time_sensitivity": "same_side_of_tfg",
        "committer_time": "2023-10-24T14:33:20Z",
        "committer_time_relation": "at_or_before_tfg",
        "effective_time": "2023-10-24T14:33:20+00:00",
        "effective_time_relation": "at_or_before_tfg",
        "parent_shas": [
          "be89daebf1b2697e0d203c96e03eb38a63f3f67d"
        ],
        "position": 1,
        "pr_number": 1621,
        "provenance": {
          "attempts": [
            {
              "attempt": 1,
              "http_status": 200,
              "retrieved_at": "2026-10-05T20:16:52.789947+00:00",
              "status": "success",
              "url": "https://api.github.com/repos/VOICEVOX/voicevox/pulls/1621/commits?per_page=100&page=1"
            }
          ],
          "retrieved_at": "2026-10-05T20:16:52.789947+00:00",
          "sha256": "65f3760c3c65c183c80e6aae44bb114f66d41399c7a990287ab63b7262dc9fbe",
          "source": "https://api.github.com/repos/VOICEVOX/voicevox/pulls/1621/commits?per_page=100&page=1"
        },
        "repository": "VOICEVOX/voicevox",
        "sha": "b1fe6815409197aa93acb738db35219bef5e356a",
        "temporal_basis": "committer_time",
        "tree_sha": "792375e5a3dd8ebe58ad1c632b1e8c5abc3b5665"
      }
    ],
    "first_post_tfg": null,
    "reasons": [],
    "selected": {
      "author_time": "2023-10-24T14:29:04Z",
      "author_time_relation": "at_or_before_tfg",
      "author_time_sensitivity": "same_side_of_tfg",
      "committer_time": "2023-10-24T14:33:20Z",
      "committer_time_relation": "at_or_before_tfg",
      "effective_time": "2023-10-24T14:33:20+00:00",
      "effective_time_relation": "at_or_before_tfg",
      "parent_shas": [
        "be89daebf1b2697e0d203c96e03eb38a63f3f67d"
      ],
      "position": 1,
      "pr_number": 1621,
      "provenance": {
        "attempts": [
          {
            "attempt": 1,
            "http_status": 200,
            "retrieved_at": "2026-10-05T20:16:52.789947+00:00",
            "status": "success",
            "url": "https://api.github.com/repos/VOICEVOX/voicevox/pulls/1621/commits?per_page=100&page=1"
          }
        ],
        "retrieved_at": "2026-10-05T20:16:52.789947+00:00",
        "sha256": "65f3760c3c65c183c80e6aae44bb114f66d41399c7a990287ab63b7262dc9fbe",
        "source": "https://api.github.com/repos/VOICEVOX/voicevox/pulls/1621/commits?per_page=100&page=1"
      },
      "repository": "VOICEVOX/voicevox",
      "sha": "b1fe6815409197aa93acb738db35219bef5e356a",
      "temporal_basis": "committer_time",
      "tree_sha": "792375e5a3dd8ebe58ad1c632b1e8c5abc3b5665"
    },
    "selected_to_first_post_relationship": "not_applicable",
    "temporal_consistency": "consistent"
  },
  "historical_observability": "not_confirmed",
  "lineage_source": "established_focal_pr",
  "materialization": {
    "commit_sha": "b1fe6815409197aa93acb738db35219bef5e356a",
    "complete_recursive_tree": true,
    "deterministic_repeat": true,
    "object_type": "commit",
    "parent_shas": [
      "be89daebf1b2697e0d203c96e03eb38a63f3f67d"
    ],
    "recursive_tree_entry_count": 333,
    "recursive_tree_listing_sha256": "c4e461e5fe86e008f964f2555e840e36ff3ffd40d6e64f96833effaab198a840",
    "retrieved_at": "2026-10-05T20:16:53.914193+00:00",
    "source": "https://github.com/VOICEVOX/voicevox.git",
    "status": "materialized",
    "tree_sha": "792375e5a3dd8ebe58ad1c632b1e8c5abc3b5665"
  },
  "pr_number": 1621,
  "procedure_version": "post-stage-c-git-lineage-v4",
  "provenance": {
    "base_pages": [],
    "base_route_evidence": {},
    "current_default_branch_candidate_used": false,
    "current_pr_base_sha_provenance_only": "be89daebf1b2697e0d203c96e03eb38a63f3f67d",
    "focal_pages": [
      {
        "attempts": [
          {
            "attempt": 1,
            "http_status": 200,
            "retrieved_at": "2026-10-05T20:16:52.789947+00:00",
            "status": "success",
            "url": "https://api.github.com/repos/VOICEVOX/voicevox/pulls/1621/commits?per_page=100&page=1"
          }
        ],
        "retrieved_at": "2026-10-05T20:16:52.789947+00:00",
        "sha256": "65f3760c3c65c183c80e6aae44bb114f66d41399c7a990287ab63b7262dc9fbe",
        "source": "https://api.github.com/repos/VOICEVOX/voicevox/pulls/1621/commits?per_page=100&page=1"
      }
    ],
    "outcome_inputs_enabled": false,
    "post_tfg_content_admitted": false,
    "pr": {
      "attempts": [
        {
          "attempt": 1,
          "http_status": 200,
          "retrieved_at": "2026-10-05T20:16:52.192984+00:00",
          "status": "success",
          "url": "https://api.github.com/repos/VOICEVOX/voicevox/pulls/1621"
        }
      ],
      "retrieved_at": "2026-10-05T20:16:52.192984+00:00",
      "sha256": "d738029a7af23492f3d525d17233e4377155e116db2647f255b5a8582754559a",
      "source": "https://api.github.com/repos/VOICEVOX/voicevox/pulls/1621"
    },
    "recorded_pr_base_ref_resolves": false
  },
  "reconstruction_contract": "post-stage-c-reconstruction-v4",
  "reconstruction_path": "focal",
  "reconstruction_status": "reconstructed_focal_state",
  "record_version": "historical-state-acquisition-v4",
  "repository": "VOICEVOX/voicevox",
  "selected_state": {
    "author_time": "2023-10-24T14:29:04Z",
    "author_time_sensitivity": "same_side_of_tfg",
    "commit_sha": "b1fe6815409197aa93acb738db35219bef5e356a",
    "committer_time": "2023-10-24T14:33:20Z",
    "effective_time": "2023-10-24T14:33:20+00:00",
    "temporal_basis": "committer_time",
    "tree_sha": "792375e5a3dd8ebe58ad1c632b1e8c5abc3b5665"
  },
  "tC": {
    "source": "first developer turn in parsed conversation; not a selection input",
    "value": "2023-10-25T17:35:01.680644+00:00"
  },
  "tFG": {
    "source": "cases/manifests/stage_c_post_resolution_authority.csv",
    "value": "2023-10-25T17:35:23.953244+00:00"
  },
  "temporal_consistency": "consistent",
  "unresolved_reasons": []
}
